{
  "schema": "xcodebuildmcp.output.device-list",
  "schemaVersion": "2",
  "didError": false,
  "error": null,
  "data": {
    "devices": [
      {
        "name": "Cameron’s iPhone 16 Pro Max",
        "deviceId": "<UUID>",
        "platform": "iOS",
        "state": "<DEVICE_STATE>",
        "isAvailable": true,
        "osVersion": "<OS_VERSION>"
      },
      {
        "name": "iPhone",
        "deviceId": "<UUID>",
        "platform": "iOS",
        "state": "<DEVICE_STATE>",
        "isAvailable": true,
        "osVersion": "<OS_VERSION>"
      },
      {
        "name": "Cameron’s Apple Watch",
        "deviceId": "<UUID>",
        "platform": "watchOS",
        "state": "<DEVICE_STATE>",
        "isAvailable": true,
        "osVersion": "<OS_VERSION>"
      },
      {
        "name": "Cameron’s Apple Watch",
        "deviceId": "<UUID>",
        "platform": "watchOS",
        "state": "<DEVICE_STATE>",
        "isAvailable": true,
        "osVersion": "<OS_VERSION>"
      }
    ]
  },
  "nextSteps": [
    "Build for device: build_device({ scheme: \"YOUR_SCHEME\" })",
    "Run tests on device: test_device()",
    "Get app path: get_device_app_path()"
  ]
}
